text,hatespeech_comb
Essas fufas ligam nenhuma mal namoradas querem marcar date porque têm saudades lol,1
Essas mulher burra raiva,1
ESSAS NOTAS A REDE GLOBO NÃO MOSTRA #ApuracaoRJ #Rio452 https://t.co/Nu6tvsMlA7,0
Essa sociedade machista opressora https://t.co/25ZOYePq5z,1
pessoas acabaram visualizar perfil https://t.co/EcEh3mNpw3,0
Essas três mulheres acusam Donald Trump denegrir mulheres... https://t.co/Miv64JkOZA,0
Essa #Veja tenta conseguem KKK quer dizer lésbicas sentem orgasmos serem lésbicas kkkkk... https://t.co/7ETyFOrswf,1
Esse aqui certeza sofreu bastante senhores engenho. Vergonha desse movimento. Lixo demais. https://t.co/3rKdx5354d,0
Esse bom tempo assim agora pra receber volta percebem ... É sentir choque Angola pra Portugal pá..,0
"Esse cara lixo humano, daqueles imbecis acham sabem tudo https://t.co/Ocs4E9fEV1",1
ESSE CARA SOU EU http://t.co/Cb1c5GSY,0
caviar tá D E L I C I O S O https://t.co/SYt9sPB0pz,0
dia começou mal receber vários feliz dia mulher posta piadinha 'loura burra' wpp família ah erra!,0
Esse padre deu Pajero pro pai menino acusou pedofilia... https://t.co/U8FE9gkOEg,0
Esse amor esquerda. https://t.co/MGO8hWrJbX,0
ESSE É O FAMOSO CHUPA CU? @g1 https://t.co/HCuJZKSNRt,1
Esse nível turma faz pessoa bem ficar desempregada seguir politicamente correto apoia _ https://t.co/mVfQ9OKdFP,0
argumento? hahaha vive mentira medo desmascarada! https://t.co/1UggXmAloF,0
Esse feminismo quer igualdade homens mulheres? https://t.co/UQpeGIjPT0,1
"filha puta donald trump diminui quantidade refugiados podem entrar país, pq nao familia ta sofrendo la",1
Esse dia MULHER reinvidicado mulher história desse país #DiadaMulher Feminismo/marx _ https://t.co/D69VSgtyj1,0
Esse futebol hoje 'politicamente correto' 'profissional' coisa homem verdade...é mariquinha..futebol ter porrada,0
galo ta tocando terror independência... #CaiuNoHortoTaMorto joga inFeliciano Malacheia la dentro sabe n morre tb?,0
ESSE IBRA É UM FINAZZI COM RABO DE CAVALO,0
Esse nome quase esquerdopata!!!! hahahahah https://t.co/seRMgQWJVx,1
Esse padre igreja aqui perto Na época pai falou ia catequese pra voltar pra casa Pajero,1
"Esse @pagapaulo fez homem perder emprego porque cara deu opinião Facebook, adivinha? A moral _ https://t.co/n8G8QBu3sb",0
Esse papo Rússia NOTÍCIA FALSA criada dems usada mídia pra mascarar grande derrota eleições _ https://t.co/4BcoHdUf2Q,0
ESSE P.S.G. É UM SÃO CAETANO QUE FALA FRANCÊS,0
ESSES DIA ESTAVAM ME CHAMANDO DISSO AQUI PUTA QUE PARIU TRABALHEI 40 ANOS NO RAMO DA MARCENARIA PRA SER CHAMADO DIS _ https://t.co/mIn3p9Kb9A,1
tal golpe aí racismo tá olhos vê,1
Está chegar hora europeus acordarem! https://t.co/d5yMsyMUyW,0
2018 chegando kkkkkkkk https://t.co/LErfp09mwc,0
"@Estadao ah tá...Venezuela paraíso, Cuba, Somália, Coreia Norte idem ha crise refugiados Europa",1
@Estadao alguem LIMPAR A IMAGEM USP né..afinal maconha MARXISMO esquerda tão destruindo univ _ https://t.co/8TSnoHdayA,0
"@Estadao aproveitando #DiaDaMulher lacrar. E ainda dizem imprensa direita, golpista, etc... https://t.co/QICjAIyBEd",0
@Estadao Caetano vive dinheiro público nunca ter sido eleito passado concurso público. https://t.co/0uR63G0nJ1,0
"@Estadao @CamilaPitanga @RachelSherazade. idiotas inúteis, mamadores dinheiro público, iludem milhões imbecis.",1
"@Estadao certíssimo! ninguém quer pseudoterrorista país, inclusive contra refugiados. Não sei são! pode ter terrorista",1
Estadão comentando algo liberado Brasil... https://t.co/SNVJbgLM88,0
@Estadao Duvido feminismo contra MACHO HOMEM pede aí! O feminismo capacho esquerda!,1
@Estadao @Emais_Estadao Mais mimimi feministos https://t.co/t9LOPMbtMb,0
@Estadao @Emais_Estadao @MichelTemer 'internautas' feminazis capacho esquerda!!!,1
@Estadao Era feminista capachos lulopetismo. Lugar mulher onde quiser. Lugar feminista onde Esquerda mandar,0
@Estadao @esportefera unica desvantagem levar bolada partes baixas ... kkkkkk,0
"@Estadao ESSES ARTISTAS / INTELECTUAIS SE ACHAM SUPERIORES A TODO MUNDO, OS DONOS DA VERDADE. O POVÃO TA CAGANDO PRA VOCÊS SEUS MERDAS.",0
@Estadao unicornio,0
@Estadao Feminismo: -defende TODAS pautas esquerda. -é esquerda perder faz protesto -nunca protest _ https://t.co/ZqhyWCJKOd,1
@Estadao @gugachacra refugiados imprensa mostra https://t.co/01MHqDPgLx,0
@Estadao @jairbolsonaro @Emais_Estadao Quem critica alguem faz leis PUNEM rigor estupradores pedofilos ??,0
@Estadao @jairbolsonaro SÉRIO? pensava q elogios...,0
@Estadao Nunca vi 'coletivismo' lutando direitos mulher islamismo. Elas massa manobra d _ https://t.co/doSd6ScAnu,0
@Estadao legal proselitismo barato sobre muçulmanas. Vamos falar sobre mutilação vaginal também? Falta direitos Islão?,0
@Estadao mulher suja porra,0
@Estadao Se estuprador 'de menor' estará garantida defesa maria rosario igual champinha. Se menina esquerda,1
@Estadao Seu comunismo Venezuela lindo ne ? Pra vc nao falta nada pro povo ? https://t.co/0OhyJOw888,0
@Estadao Tem outras teorias tambem.... https://t.co/v8LBub6Gpn,0
@Estadao Trump demitiu cara audiência Aprendiz tava caindo! Correto!,0
@Estadao Usou tanto pensa mais... enquanto mora dia dia comum sofre violencia pq d _ https://t.co/PJUC7AtZ34,0
Estado Segurança Privada Portugal https://t.co/xdH26hs0q4#RenovarPortugal #PNR,0
@estadohiramico feminismo massa manobra esquerda...e nao negarem isso..tb nunca vi contra F _ https://t.co/pq9kfmUEj6,0
@estadohiramico stf vergonha https://t.co/QbLebf82Wc,0
Esta matéria explica todo conteúdo dessa 'BIBLIA INFANTIL' ridicularizam personagens acontecimentos dá... https://t.co/MoMbrpJwFB,0
Estamos crescer. Assim continuaremos. cada vez mais! #PNR https://t.co/acRL7L2GbU,0
"Estamos olho !Foram 2milhoes assinaturas, hoje mais, descontentes roubalheira. https://t.co/r2av8VyCLj",0
"Estamos todos refugiados pessoas somos! “Consumismo ato comprar precisas, o... https://t.co/PQRBru4VHe",0
"Esta notícia DEZEMBRO, notícia Velha.Mas falta assunto, Isto publicou novamente ,para difamar o... https://t.co/5B9UDtkY3J",0
Estão abertas inscrições turma 2017 'Atinuké' - Grupo estudos sobre pensamento mulheres... https://t.co/dhAEmv7g5Q,0
Estão cada vez totalitários! Correm tudo proibições extorsões. É dogmas tabus... Mundo louco! https://t.co/6EqrTVzYim,0
"Estão todos perguntando VETO não. Chame quiser, objetivo manter marginais (com péssimas intenções) país!",0
"Estará acabar 'estado graça' presidente afectos? Tudo fim, certo? #MarceloRebelloDeSousa https://t.co/4MBQlm8fxJ",0
ESTAR ACORDADO SÁBADO DE MANHÃ DO CARNAVAL ISSO SEPARA NÓS: O POVO HONESTO E DIGNO DELES: QUE FICARAM ATÉ DE MADRUGADA SE DROGANDO NAS RUAS.,1
ESTAR ACORDADO SÁBADO DE MANHÃ ISSO QUE SEPARA NÓS (POVO HONESTO E TRABALHADOR) DELES (VAGABUNDOS DROGADOS E CORRUPTOS) BOM DIA BRASIL #PAZ,1
Esta senhora completamente obcecada Trump. Haverá alguma explicação freudiana? @fcancio #ForçaTrump https://t.co/5SFjTYzgDx,0
Estas poeiras vindas norte África entram impunemente Portugal sujam carros todos. Para construção muro?,1
Esta boca propaga nazismo chupa pau??,1
Está toda gente queixar-se tremer frio. TODA A GENTE! Toda gente menos doentes Parkinson. Para 5ª feira,1
Estava passar casal fufas luana grita 'HA BUE FUFONAS EM ALMADA',1
Estava mechendo baú avô falecido achei foto aqui https://t.co/rhDE3UPdd1,0
Este ano vamos comemorar dia Restauração Santa Maria Feira. https://t.co/yBPt8F461l,0
Este 'aquecimento global' severo.,0
"Este #CDS, realmente... vergonha! De facto, torna-se cada vez claro #PNR lado Sistema to _ https://t.co/9MiFbWxAbp",0
Este 1º País Mundo proibir islão fechar mesquitas https://t.co/tzf7IOTfFN,0
"Este fim-de-semana caravana vai andar aqui: - 10 Fev: VILA REAL - 11 Fev: COVILHÂ Bilhetes FNAC,bilheteira _ https://t.co/C6ks5FIt96",0
Este plot twist final cerimónia escrito George R. R. Martin foi? #Oscars,0
Estes 2 golos respetivas jogadas prova Benfica claramente levado colo Taça Liga #VERGONHA,0
Este Zivkovic pequena maravilha,0
"Estimar idade argumento??? Quero ver refutar falei fatos, lógica verdades! https://t.co/TYHxHoRJB7",0
"Estivemos ontem convite pré-estréia documentário #euvocêtodasnós, co-produção Coopas & Canal... https://t.co/hlxnByQqdK",0
"Estive pensando... Uma #MulherDeVerdade íntegra. Com sentimentos, consigo, outros. Essa essência!",0
Estocolmo: capital violações! As mulheres andam medo mudam hábitos vida. 'Welcome R(ap)efugees'? _ https://t.co/BxSrVriKNC,1
"Estou aguardando algum pedido c/ burca, tem?. Mulheres usam deserto, onde tempe _ https://t.co/qPqJGbTqIR",0
"cansada palavras: homofobia, racismo, gordofobia, feministas!!!! queria voltar pros anos 90, ouvia bem menos.......",1
ESTOU LANÇANDO MINHA MARCA DE CAMISETAS ESSA É ESPECIAL PRO #diainternacionaldamulher BELA OPÇÃO PRA PRESENTEAR O _ https://t.co/m4zsYjHxZs,0
"Estou lendo preço grande MURO fronteira custará governo esperava inicialmente, ain _ https://t.co/EZwOmnq7UM",0
sentindo jundiaiense já. pra faculdade perguntei coxinha frango. mulher faltou chamar burra dizendo que+,1
"Estou dúvida ver #Agarraamusica SIC, 'Desafio Final' TVI balde ácido retina",1
Estou tão orgulhoso filha Ivanka. Abusada maltratada mídia ainda mantém cabeça tão erguida: ver _ https://t.co/rLTZlmMxC7,0
Estou trabalhando sistema onde haverá competitividade Indústria Remédios. O preço povo americano s _ https://t.co/uNS6lVHht0,0
Estranho... dinheiro recebo pra fazer faço desviado meio caminho? Nunca recebi. https://t.co/JqrfbtXDN0,0
"'estudando graças feminismo' ENEM 2018 - Ao invés redação, faça textão inventando abuso sexual banheiro balada",0
@estudioi ter tempo pra cuidar família 'o grande problema' pra mulher pra qq pessoa trabalha E filhos?,0
"É suposto religião critério discriminar refugiados. Nem negativa, positiva. https://t.co/dFlBu7D4eW",0
tanta caloura sapatão vai ter apresentações voz violão cantina durante intervalos,1
tanto calor to começando gostar fala cuspindo,0
tava reclamando gorda feia vou continuar assim,0
"E tbm refugiados, qm casa, q passam fome, qm abandonados pais familiares enfim todos q sofrem",0
"E evangélicos fazendo fantasia, outras dizem evangélicos tirando roupa carnaval. Parabéns!!! https://t.co/0EhUl3ngIS",1
"nordestino manaura achando ruim piadinhas regionais... vcs sempre zuados, msm certificarei disso. acostumem-se",1
É tempo abrir olhos perceber governados amigos terroristas. https://t.co/fWMOKbiWz6,0
'Eu acho q nasce c bichinho matrafona'(ouvido SIC). As desculpas q homens dão família pra justificar vestirem-se d mulher,1
"Eu acho Movimento Negro realmente humildade seriedade próprio movimento, MÍNIMO devem _ https://t.co/aXUptQH2lf",1
"apenas desmascarei argumentos, cara! https://t.co/rsw9FTj79z",0
"Eu apresento fatos, lógica verdade. Ela: - olha argumentos - ta passando vergonha E consegue refutar _ https://t.co/UdwhGBUHiD",0
Eu argumentando sujeito acredita crise refugiados pobreza projeto califado. Desisti argumentar,1
Eu arroto pq engole gás judeu,1
Eu linda branço,0
Eu 4 seguidoras neste fds https://t.co/8Sg2vYqlfV,0
"Eu cresci ouvindo: 'nossa, mulher mesmo?' 'nunca vai ter filhos' 'nunca alguem vai amar' 'vai ficar pra titia, viu?' 'tu sapatão?'",0
"@eudadisie meu, use menos droga vc vai sentir menos fome hahahaahahaha",0
"Eu devia indignar-me c discurso d dono d Padaria Portuguesa porra,aquels croissants brioche feitos mãos q ganham €_500 tão bons",0
"devo mt feia, pq gorda sou...",0
devo ter jogado angry birds cruz pra merecer,0
"Eu fico indignada vejo brasileiro desmerecendo refugiados imigrantes, acho q nao conhecem história BR ne mores",0
"Eu ganho menos sr, q ganha 33 mil mês. Favor transferir parte salário sexta. Grato. https://t.co/1y35PYsVbQ",0
Eu gostava ereção @guilhermefon esconder desde viu @joaopauloshowsa vestido noiva #ccallstars,0
"EU GOSTO É DE MULHER BONITA CHEIROSA BEM CUIDADA E BEM RESOLVIDA, CANHÃO PROBLEMATIZADOR DE SUVACO PELUDO NÃO TEM VEZ AQUI NÃO #PAZ",1
Eu honestamente emocionei lendo. Vale pena,0
EU IA E VOLTAVA VÁRIAS VEZES (COM TODO O RESPEITO) @Chris_Branco,0
"Eu sinto tao feia gorda, aí pessoas vem dizem 'vc tão bonita, ta gorda' Me logo tiro fdp #askanamia",1
@euluana66 pois é! homem acha orgasmo feminino existe (risos pesames mulheres transaram esses),0
É absurdo certos tipos Cultura. Uma criança pode casar. Mas obrigadas usar burca algumas não... https://t.co/zMxDAu98LH,0
É mentira escandalosa tentado invadir sede @LIVREpt @ruitavares https://t.co/alD5cOz6Mi#Portugal #PNR,0
"mandei argumentos baseados fatos, lógica verdades! Ela reponde isso! hahahaha putz!!! https://t.co/prFqBrxi1R",0
E certo partido ai perdeu 400 prefeituras onde lavar dinheiro...,0
arrumei exatos 3 min pra trabalhar,0
afilhada https://t.co/xCgpbnxOYZ,0
"Eu, Nacionalista confesso! https://t.co/vWinrjkfkz#PNR #RenovarPortugal #Portugal",0
defendo bandido favor impeachment pro temer entrar cunha vice,0
"Eu nao defino Angolano cor, branco, preto mulato defino Angolano ama Angola _ https://t.co/sTch48FBfg",0
"Eu importo pessoa magra gorda feia bonita humanas exatas, tratar bem vou retribuir mesma forma",0
Eu mereço estuprada banheiro feminino mulher trans lésbica! NÃO ideologia gênero,1
preciso resolver. Só mostro verdade vive escondendo mentiras!!! https://t.co/IX6VzBQNbX,0
"EU NÃO QUERO TER FILHOS, EU NÃO PENSO EM TER FILHOS, E NÃO TEM NENHUM PROBLEMA NISSO!!!",0
sabia dia mulher viria tanta gente burra falar bosta internet,0
Eu sei dizer quanto queria trabalhar voluntária p refugiados afins,0
"nao homofóbico, mas...........",1
Eu 6° ano sentia-me rebelde porque chamava amigas 'fufinha' ficavam felizes qd vdd insinuava q fufas,1
"nunca senti tão gorda, tão feia, tão... tão mal",0
"Eu odeio dia d tpm pq sinto feia gorda pessoas amam n tão ai p mim, pior saber q dias reais",0
EU PAGO TUDO QUE CONSUMO. TENHO O NOME LIMPO NA PRAÇA https://t.co/uD3IHN8UYJ,0
@eupatyoliveira preparada https://t.co/R5iTupPnzo,0
"Eu posso feia, gorda,e concordar isso,posso chata maioria tempo, precisam mim, smp tô lá",0
"EU PREFIRO MEIA BOCA, NÃO TOTALMENTE LISINHA NEM FIDEL CASTRO MAS UM GUERREIRO NÃO FOGE DA LUTA ENCARO O QUE VIER _ https://t.co/q0kd0LNvIo",1
prezo igualdade gênero femimimismo,0
"queria namorar teto, aí perguntaria 'NA SUA CASA OU NA MINHA?' ai gente ia rir rir rir beber pinga R$0,50",0
Eu quero bela fera estreie logo pra PARAR ver propaganda desse filme socorro aguento,0
respeito homossexuais so n concordo quero q filho veja beijando público,1
@euronewspt @Ramo_Jr A direita vai corrigir cagadas esquerda fez Europa últimos 20 anos. #Nexit #Frexit,1
Eu sabia ainda visto tudo possível sobre destaque desse carnaval.... https://t.co/Oxb4SGd3pe,0
sabia manifestações nao contra corrupção queria tirar dilma,1
sei todas notas real ta escrito 'deus louvado' estado laico,0
"Eu sei bonita precisa magra, coloquei fucking cabeça gorda feia",0
Eu servindo café manhã pra irmã. Ela gosta leite quente ovos logo cedo https://t.co/AKRPhwkgue,0
sofro preconceito igreja evangélica ngm liga ne aí jogam pedra macumbero 'ooooh mds triste',1
"Eu quero feliz Zuar barriga, orelha nariz E poder orgulhar De cortar bolsa-família botar pobre pra trabalhar",1
mulher burra brasil,0
"'Eu mulher fez escalada montanha vida, removendo pedras plantando flores.' #MulherDeVerdade",0
"Eu bi sapatão. E fosse, ninguém nada ver isso!",0
"Eu boa, amigo q grosso #AsFortesEntenderão",0
"Eu demasiado tudo. Demasiado alta, demasiado gorda, demasiado feia, demasiado paciente, demasiado sentimental, puta pariu.",1
"gorda, cabelo bom, cara bem feia",1
"Eu mt burra, menino falou 'feliz dia mulher' ai 'pra também', percebi",1
oficialmente mulher burra mundo,0
Eu tô bem surpresa gringos sabiam caju https://t.co/IShGlhKQs2 via @ErinChack,0
"Eu tô inconformada, chorando, pude tão burra? Sempre pensei Solange aviões mulher Xand. Não vou conseguir superar",0
"EU TENHO PENA DAS MULHERES COM ESSE HOMENS DE HOJE ACHO QUE EU VIRARIA SAPATÃO, OLHA DÁ VERGONHA DA MINHA RAÇA _ https://t.co/z4wRncC98n",0
problemas psicológicos causados excesso corrupção petista......,1
Eu livrinho cabeceira passa pano branco pra político https://t.co/ToitIjbbfL,0
"Eu tanta coisa pra twittar hoje aqui, acabei esquecendo...",0
Eu tocando coração irmã https://t.co/CKFwMubQ2m,0
"Eu tomo decisões amplamente embasado dados coletadas todos sabem. Alguns jornais NOTÍCIAS FALSAS, pr _ https://t.co/Xug8AiwJOd",0
to sapatao scrr,0
Eu to passada quanto cara acha mulher obrigação conversar tinder deu like. Ou chama puta.,0
"Eu vejo torce pra Emilly historico torcida igual. Não gente feia, gorda. Nada padrões",0
Eu volteiiii agora pra ficarrrr,0
EU VOU CANTAR ESSA PAIXAO QUE VEM DE DENTRO UM SENTIMENTO VERDE BRANCO E GRENÁ #DiaDeFlu,0
E vc ae ainda tentando pegar amiga https://t.co/YF0U7uHUuV,0
E vc aí franguinha dessossada reclama vida! Para chorar porra.,0
E vc aí mulher sabe chutar bola direito https://t.co/APQBR6I61Q,1
É verdade CND permitiu FBI verificar servidor outros equipamentos após descobrir hackead _ https://t.co/6vPS8k6t0F,0
Evitar carne ganso (quizila Oxum) Não comer carne pombo galinha d'angola Não ter dentro casa penas pavão pq tiram sorte,0
E você? Está fazendo parte? Cenas filme Lista Schindler. Impossível emocionar. https://t.co/yNV0RW7cay,0
"E , escolheu presente mulher , dia internacional mulheres ?? sugestões garota _ https://t.co/laX8xO9hSI",0
Ex-ativista LGBT torna pastor inspira filme: “Estou aqui honrar Deus”... https://t.co/B8c0ZW5qAd,0
"Ex-candidato PSOL preso estuprar cães portar drogas. Estes piores PT, aberrações. (Vídeo) _ https://t.co/eOysLFT1yo",1
"Excelente pergunta! Cidade abandonada!! Centro completamente dominado camelôs, agentes CET Rio sumiram tr _ https://t.co/z66lz9CSD8",0
"EXEMPLO DE PAI, SORTE DAS FILHAS. ESSE NUNCA VAI CHORAR NO BANHO. https://t.co/spcJwx0ZOc",0
Exemplo: Nizan Ganaes Bundão.,0
Ex Gays existem. https://t.co/kUkFDz294y,1
existem dois tipos casais https://t.co/ozTrbrTyJY,0
"Existem mulheres ladras, canalhas, safadas, dissimuladas.... sinto voce sabia disso !! Feliz dia m _ https://t.co/KwOFFQXWaj",1
existem negros nazistas sim,1
Existem pessoas ainda jogam 'Perguntados' 2017. E ainda admiram mundo vá acabar hoje,0
"Existem várias formas noticiar assunto. Infelizmente, alguns escolhem pior. Felizmente, outros não. https://t.co/gKjEYzrsDb",0
"@expresso @HenriquMonteiro Explicado?? Diria antes, deturpado diabolizado. Como qualquer insurja contra sistema, odiado.",0
#Extra #DonaldTRUMP revogou ordem #Obama retirou banheiros transgêneros escola. parabéns... https://t.co/pDNr2gXXeu,1
"#Extra Próxima novela 9,abordará transgêneros, desde infância. Lembre-se associação Americana de... https://t.co/9cQuI5EmJc",0
fábio frente parece sapatão masculina,1
"@FabisMorelli miga nao livro estudos promoçao , mulher burra",1
Faço churrasco dessa carne dia inteiro https://t.co/jartybLaNe,0
FAKE NEWS! Toda gente sabe brancos praticam escravatura Islão religião paz. Só propaga _ https://t.co/0Z0o0cFRk6,1
fala ae esquerdopata,1
Fala ai mariquinhas afins.... Como vai falta culhão resolver qualquer coisinha ?,1
fala squad —_ bando fufas queridas <333 https://t.co/rA9YQ35HtJ,1
"fala mim estúpido —_ És feia, gorda, chata, curto ti https://t.co/xPWkVAMfuE",1
"Falam Trump, vários países aceitaram refugiados – DexMag - https://t.co/LJ3ApghgaB via @dexmagazine",1
"Falando tpm, menstruação ta atrasada 2 semanas... Se sapatao ia preocupada",1
Fala odeia PM agora @alibanio_ https://t.co/dvJ4a2We4d,1
falar verdade. Te incomoda? https://t.co/U8kUA7jCRy,0
Falei mal macho DIA DA MULHER tava falando burra n msm,1
Falou q chama pessoas burra pq quer ficar casa fazendo papel mulher: LAVAR LOUÇA https://t.co/dGba7kK2oy,1
Falou 'populista' sei turma 'fake news' RETARDADO! https://t.co/Dr87lJ0zBg,0
falou tudo !!! FEMINISMO capacho esquerda PONTO FINAL @helenbraun_ https://t.co/k7qtCbEOLx,0
"Faltam neste momento, menos, 1200 Guardas Prisionais cadeias. https://t.co/s8KYk8ecNt#GuardasPrisionais #Portugal",0
@Famel_Zundapp bom dia! Finalmente metes foto tua!,0
"@Famel_Zundapp Famel, cabe Quechua?",0
@Famel_Zundapp colchão assim...,0
@FaniPacheco deformidade. É excesso gostosura tá linda assim. Pq gorda feia?,0
"farta procurar trabalho, ainda meto trabalhar bar fufas, vale",1
"Fascista, machista, nazista, trapezista, taxista, maratonista, eletricista, corrupto? kkk https://t.co/fQ5KK6vxH7",1
Fascistas machistas mimimi mimimi https://t.co/m81sXtGhGn,1
Fãs Justin Bieber acessórios https://t.co/IESZyMre5y,0
"Fátima Bernardes pára repetir 'o estrago homem branco causou' chegar Brasil. Vai estudar, vai, besta!",1
"@FatimaRD qualquer outro jogo casino, Casa sempre ganhar. E Santa!...",0
@FatimaRD Santana topa!,0
"FATO: Estamos plena extinção, mundo sendo dominado bibasexuais, creminhosexuais, saladinhasexuais, metrosexufrangas!",1
"Fato ocorrido NOVA YORK, reduto DEMOCRATA onde Trump perdeu lavada, agressor trumpista??!? Vocês sã _ https://t.co/9io5RbMWoQ",0
@FatosEsquerda ixquerda desconstruindo pedofilia,0
FATO: Tem muita mulher @homemdeverdade mariquinha fresco ai !,1
"FAZ ASSIM, FALA COM ELE: OU SUA MAMÃE PARA DE SE OFERECER OU PASSAREI A LINGUIÇA NELA. HONESTIDADE É SEMPRE O CAMIN _ https://t.co/dcaofcwXCK",1
faz campeonato peido amigos.,0
Faz favor pra gente @bfhiago https://t.co/YfMs3DD6Q5,0
Faz bem. Chega #FakeNewsMedia ! #Trump https://t.co/PDgPYsCL9A,0
faz pontaria qlq coisa q der telha jato mijo.,0
'FAZ SUCESSO' 'POSTAGENS INSPIRADORAS' Esse nível grande imprensa brasileira https://t.co/u7RJ39XZj5,0
"@fcancio ahahahahah média?? São maior pouca vergonha, manipuladores, tendenciosos. Mas... ainda continua pensar Trump? Livra!...",1
@fcancio Ainda 'estadista' nervosa? https://t.co/yJxL6NpQYJ,1
@fcancio Estava pensar Trump. :),0
@fcancio Faz muitíssimo bem!,0
@fcancio Pesadelo? Naaaa... Um sonho vai tomando contornos realidade.,0
"@fcancio, peso-pesado gangue comunicação social. Apesar censura cobarde ridicularizarem opõe, começam tremer.",0
"@fcancio Só pensa Trump. Só fala Donald. Algum fetiche? Claro esperança novo amanhecer, varie tema. ;)",0
"@fcancio Tão 'tolerantes' democratas, sabem perder. Os hipócritas ressabiados vão esgotar medicamento https://t.co/sEsLcWaILG",0
"@FCMorango dá fuçada lá, primeiro livro amiga @melaineribeiro www.aescritoraeomusico.blogspot.com (eu reviso)",0
"@fcnossamorango Excelente post, história tb... :)",0
Fds eus hj dia mulher tas-te fzr burra outra pessoas escrever título _ https://t.co/3amPtQETk7,1
FECHEM O JUDICIÁRIO BRASILEIRO!! FALAR A VERDADE AGORA DÁ MULTA! #paíspiada https://t.co/txhzaC1E4F,0
Federer enorme. O Rei voltou,0
@Feherrr Constantine bem foda,0
"Feia Bonita, Gorda Ou Magra Mulher Foi Feita Pra Ser Respeitada",0
"Feia bonita, gorda magra, for, mulher nasceu respeitada!",0
"Feia bonita , gorda magra mulher nasceu respeitada . Feliz dia Mulher todas",0
@FeiticeiraDrink Já percebeu militante feia gorda fala mal homem ?,1
@fejao2 @NandoMorais3110 @g1 Para massa manobra esquerda cara https://t.co/ALodwaOeVZ,1
feliciano estuprador gente tudo marketing esquerda,1
@felipefepacivil kkkkkkkkkkkkkkk abelha sempre voltaaaa rsrs,0
@felipefepacivil sei '-' completei música... Rs,0
@felipefepacivil viajei mochila tb... 4 Dias,0
@FelipeHamachi desespero pra ganhar foda tá demais,0
"Felipe Neto foda meados 2009/2010/2011, mandava bem humor negro! Virou personagem bicha pra ganhar money gayzada",1
FELIPE NETO X PASTOR MALAFAIA IGUAL A ARGENTINA X ESTADO ISLÂMICO NÃO TEM COMO ESCOLHER UM LADO SÓ QUERO VER SANGUE #PAZ,1
@felipetlo @Felipebastos022 gorda feia bêbado,1
"Feliz dia da: Gorda, feia, magrela, bruxa, velha, frágil, empregada...",1
Feliz dia mulher ....da M-U-L-H-E-R #DiaDaMulher #BolsonaroReiDoMundo FELIZ DIA DAS MULHERES Dia Internaci _ https://t.co/2KgqXloDpw,0
Feliz Dia Mulher! #DiaDaMulher https://t.co/hHeS4bmMlC,0
#FelizDiaDaMulher história merece revista. https://t.co/8a4k7BEiXz,0
"feliz dia mulher pra mim, aguento tanta gente ignorante, machista burra, sorriso rosto dar cara ninguém",1
FELIZ DIA DA MULHER #SerMulherÉ usada feminismo esquerda. https://t.co/mnGPAKvj7M,1
"Feliz Dia Da Mulher p/ mulheres brancas,pq dia mulher negra latino americana caribenha,é dia 25 julho!Segregação esquerda",1
feliz dia mães pras mães verdade #NaoAoAborto,0
"Feliz dia mulheres bem, direita vozes atos fazem Brasil país melhor ! https://t.co/P1QNj5QUmz",0
Feliz Dia Mulheres Femininas!,0
Feliz dia mulheres! https://t.co/B4DysDuGw4,0
"feliz dia mulheres Beatriz, vitima estupro coletivo 33 caras RJ. apoio algum ainda gente duvidando",0
Feliz Dia mulheres pra nós!!!!,0
FELIZ DIA DAS MULHERES PRA QUEM NASCEU HOMEM E ACHA QUE PRA SE MULHER BASTA COLOCAR UMA SAIA O SEU DIA É 1º DE ABRIL #InternationalWomensDaY,0
Feliz #DiaDasMulheres pras verdadeiras guerreiras trabalham cuidam lar enquanto vagabundas lutam pra abortar andar pelada,1
"Feliz dia mulheres pra Tammy Gretchen Que várias alterações chassi, continua sendo mulher!",1
Feliz dia mulheres pra depila faz textão Facebook!,1
Feliz dia mulheres vieram embalagem certa! https://t.co/hl3A1wmiXz,0
"Feliz dia mulheres @RachelSherazade, certamente principal voz feminina TV",0
Feliz Dia São Valentim https://t.co/uzJ7UKTS8l,0
Feliz dia amigo faz escolhas erradas!,0
Feliz dia amigo come gordura Picanha!,0
Feliz dia amigo toma pinga!,0
"Feliz dia 'essa puta', 'essa vadia' 'essa feia' 'essa gorda', huuuuum gostosa. Feliz dia do... https://t.co/WhU5Qar7lg",1
Feliz dia 'eu acho engraçado que...',0
Feliz dia 'Eu acho engraçado que......',0
"feliz dia 'eu to gorda, feia inchada' feliz dia TPM meninas",1
Feliz dia internacional mulher! https://t.co/zcICp6wAWp,0
Feliz #DiaInternacionalDaMulher pra possui cromossomo XX,1
Feliz dia internacional kiridinhas!!! https://t.co/xyzFLD63uMhttps://t.co/OBtcfYhfsN,0
