text,hatespeech_comb
RT JOAQUINVOLTOU ALÔ REVOLTADOS COM LADRÃO HOSPITALIZADO VÃO NA FILA DO SUS SENTI PENA DO POVO HUMILDE QUE LEVA FERRO TODO DIA POR C,0
RT JOAQUINVOLTOU 21 anos Mamonas Assassinas SE ELES FOSSEM VIVOS VOCÊ ESTARIA FAZENDO TEXTÃO ACUSANDO OS CARA DE MACHISMO HOMOFOB,0
RT JOAQUINVOLTOU BRANCO RICO COM PROBLEMA NA JUSTIÇA PODE TIRAR PHOTO SIM NEGRO COM PROBLEMA NA JUSTIÇA VERGONHA TIRAR SELF COM ELE,1
RT JOAQUINVOLTOU CALMA CACHORRO ELA AINDA NÃO VIROU RAÇÃO PAZ httpstcoma4r3DOJpi,1
RT JOAQUINVOLTOU COM MUITO ORGULHO FUI ELEITO O REIMOMO DO BLOCO PORÃO DO DOPS DO MEU AMIGO editorahumanas DECOREM AS MARCHINHAS A FOL,0
RT JOAQUINVOLTOU DEFENDENDO AS BRANCAS E LOURAS CONDENANDO O NEGRO RACISMO ATÉ QUANDO httpstcoqKdhMDYor0,1
RT JOAQUINVOLTOU DESCONSTRUINDO O GÊNERO CACHORRO httpstcoLZLxHKzqVyhttpstco0DXrooVPCC,0
RT JOAQUINVOLTOU ELE NUNCA VAI VOLTAR DESSE JEITO VEM METEORO httpstco7U0zOCm0u8,0
RT JOAQUINVOLTOU ESSE PSG É UM SÃO CAETANO QUE FALA FRANCÊS,0
RT JOAQUINVOLTOU FELIPE NETO X PASTOR MALAFAIA IGUAL A ARGENTINA X ESTADO ISLÂMICO NÃO TEM COMO ESCOLHER UM LADO SÓ QUERO VER SANGUE PAZ,1
RT JOAQUINVOLTOU GOLEIRO BRUNO E MACARRÃO MACARRÃO MACARRÃO DE DIA VÃO PRO SÍTIO DE NOITE ALIMENTAM O CÃO,1
RT JOAQUINVOLTOU IU FATER CRY IN THE SHOWER SIGNIFICA SEU PAI CHORA NO BANHO EM INGLÊS,0
RT JOAQUINVOLTOU O TUITER AINDA RESPIRA httpstcoc3iyZGYkRh,0
RT JOAQUINVOLTOU PUTA QUE PARIU ALGUÊM ENTENDEU ALGUMA COISA httpstco5VIe6Lcexx,0
RT JOAQUINVOLTOU QUANTA IRRESPONSABILIDADE DEVE TER MATADO A FAMÍLIA DE DESGOSTO httpstcoGuzZdgqlCx,0
RT JOAQUINVOLTOU QUE COMECE O DESESPERO CarnavalAcabouE FELIZ 2017 httpstcowGEk6AWDgd,0
RT JOAQUINVOLTOU QUE NOITE TERRÍVEL SONHEI QUE TINHA VOTADO NA CHAPA DILMA TEMER E AJUDADO A ELEGER ESSA QUADRILHA ACORDEI ALIVIADO,0
RT JOAQUINVOLTOU SOBRE ESSE TAL DE GOZA NA MINHA BOCA httpstcoI1VTf6qXQq,0
RT JOAQUINVOLTOU SOCIOLÓGO CHORA FILÓSOFO PASSA MAL CHEGA DE FALA MERDA NA SALA DE AULA PRA ISSO TEM A REDE SOCIAL,0
RT JOAQUINVOLTOU TÁ CERTA A MARIA DO CORSÁRIO TEM QUE PROCESSAR ESSE CACHORRO SAFADO QUE ROUBOU O CIGARRINHO DA SUA INOCENTE FILHA PAZ,0
RT JOAQUINVOLTOU TER O CRAQUE NETO COMENTANDO FUTEBOL EUROPEU É A MESMA COISA QUE TER O GOLEIRO BRUNO COMO CONSELHEIRO AMOROSO,0
RT JOAQUINVOLTOU UÉ TURMA QUE DEFENDE MARGINAL REVOLTADO COM O PESSOAL TIRANDO SÉLFI COM O GOLEIRO BRUNO ENTÃO ESSE GUERREIRO DO POVO N,0
RT JOAQUINVOLTOU VAGABUNDO CHEGA AGARRANDO AS MENINA SEJEM CAVALHEIROS OLA TUDO BEM VOCÊ É LINDA SEUS LABIOS DEVEM TER GOSTO DE MÉL VAMO,1
RT JOAQUINVOLTOU VOCÊS JÁ APRENDERAM A CANTAR A MARCHINHA SENSAÇÃO DO CARNAVAL 2017 httpstcoNzHDmaVjen,0
RT joicehasselmann A imagem diz tudo OdeCarvalho deltanmd jairbolsonaro BolsonaroSP realDonaldTrump httpstco0oXe6Jce0s,0
RT joicehasselmann Isso GRAVÍSSIMO Divulguem httpstcohXyqZW4u1q,0
RT jorgeiggor Trump cortou grana grupos próaborto Ótima medida httpstcoha6tanMpRf,1
RT jornaldarecord Começa amanhã 6 nova série JR mostra esquema corrupção envolvendo BNDES América Latina Não perca h,0
RT JornalismoWando Lembrando homem recebido governo golpista apresentou propostas área Educação https,0
RT JornalOGlobo Senado pede reforço Casa Branca após ameaças centros judaicos httpstcobwnPiGPqn0httpstcoynzxXGJxxK,0
RT JoselitoMuller3 Dilma adere greve sexo convocada Gleisi Hoffmann httpstcowvAt2vN3zS,0
RT JoselitoMuller3 Mulheres minorias estivadores apesar políticas inclusão httpstcoPQkoP8mcFOhttpstcoTrKLN6y3,1
RT JoselitoMuller3 O surpreendente nessa história filha Maria Rosário saber deputada virgem,1
RT josesoubrasilia HORA DE ACABAR COM OS CORRUPTOS VAMOS OCUPAR O CONGRESSO A PM É POVO httpstcoHZuJGKZCm0,0
RT josesoubrasilia HORA DE INVADIR O CONGRESSO A PM NÃO VAI ATIRAR CONTRA NOS httpstcoJ03AjeGQf0,0
RT josesoubrasilia OCUPAR O CONGRESSO A PM É NOSSA IRMÃ httpstcoEi0A3ImstF,0
RT josesoubrasilia O PODER EMANA DO POVO A PM TAMBÉM É POVO BRASILEIRO httpstcoo3wiRZhKwO,0
RT JotaInfo Polêmica semana Prisão 2ª instância vale foro Fux liberta juiz condenado reacende debate httpstco,0
RT jpapacidero O mito httpstco48QQWR3OyS,0
RT jpintocoelho60 Abram olhos equação UE CDSPP ppdpsd psocialista PCP BE escravidãoausteridade Até quan,1
RT jpintocoelho60 A Europa doente submissa espectáculos mariquice nojenta claro torna presa fácil Islão in,1
RT jpintocoelho60 Ainda propósito sosracismo afins aqui ficam palavras alguém próprio sistema Pacheco Pereira ilgaportugal,0
RT jpintocoelho60 Ameaça Ridículo Estão mal habituados podem dizer querem nós vêem ameaças onde existem Que,1
RT jpintocoelho60 Aqui lágrimas Soares elogios fúnebres sempre considerei traidor inimigo sentia intocáv,1
RT jpintocoelho60 AsiaAntar morreu combate Daesh Que perdure exemplo sacrifício vão httpstco,0
RT jpintocoelho60 Assim sim Um homem determinado cumpridor Força TrumpPresident httpstcoanW8LopFgs,0
RT jpintocoelho60 Começa felizmente desenharse bloco alianças contra podridão globazidoramundialista netanyahu realDonal,1
RT jpintocoelho60 Destinado teimosos tantos acham utilidade chamado voto útil Percebam simplesmente voto traidor,0
RT jpintocoelho60 Duas evidências Consequência volta casa faz boa viagem ImigraçãoInvasora Islão realDonaldTrump https,0
RT jpintocoelho60 Esperança vitória Brexit efeito dominó sobre aberrante UE UNIAOEUROPEIA não Europa Nações sim ht,1
RT jpintocoelho60 Estocolmo capital violações As mulheres andam medo mudam hábitos vida Welcome Rapefugees Refugees,0
RT jpintocoelho60 fcancio pesopesado gangue comunicação social Apesar censura cobarde ridicularizarem opõe,1
RT jpintocoelho60 Isto cá grande buraco Como Sócrates anda cá fora Lusanoticias rtppt dn fcancio httpstcoSV9,0
RT jpintocoelho60 Isto deitar lenha fogueira Querem 75 milhões muçulmanos livre circulação Europa Traidores ht,1
RT jpintocoelho60 Mentirosos ruitavares LIVREpt Quisemos assistir debate embora Graças PSP Hipócritas cobardes https,1
RT jpintocoelho60 Nomes faltam vigaristas corruptos aldrabões assassinos vendidos traidores pedófilos aberrações 25Abril,1
RT jpintocoelho60 O grande bandalho LuísPedroNunes Ofende enquanto podes dia caça outro caçador SIConline expre,0
RT jpintocoelho60 Orgulho AntonioGuterre ONU Nunca O confronto político tempo Nacionalismo Globalismo htt,0
RT jpintocoelho60 Os animais islamitas continuam atacar solo europeu A culpa governantes traidores criminosos Só Naciona,1
RT jpintocoelho60 Participação PNR autárquicas vai crescendo Com programa nacional diferenças locais pode dizerse todos dif,0
RT jpintocoelho60 Por detrás país cores vende Regime crua realidade tanta miséria moral material httpst,0
RT jpintocoelho60 Quem vai ganhar negociata Quanto paga contribuinte mais Já agora votou FMedinaPCML Pre,0
RT jpintocoelho60 Razão coragem contra infâmia O medo passa aqui PNR Nação Identidade sosracismo EsquerdaNet psociali,0
RT jpintocoelho60 Sim praticam censura PNR boicotamnos Respondem sempre sorrindo evasivo olhe não Mas s,0
RT jpintocoelho60 Triste verdade tantos teimam querer ver Quanto tarde reverter situação difícil será Islão,0
RT jpintocoelho60 Uma candidatura realmente diferenciadora httpstcoGjHeWfygza,0
RT jpintocoelho60 Vai continuar encolher ombros vai mudar apoiar PNR httpstco8UCBJ0yWMS,0
RT jpintocoelho60 Vivemos totalitarismo pensamento único donos liberdade Só PNR enfrenta denuncia besta https,0
RT jromaoferreira PSD CDS querem sms Centeno 18h caso aconteça apresentam 1815h candidato conjunto Camara,0
RT juandddrade 7 to CAGANDO pras pessoas chamam gorda magra alta baixa feia etc opiniões vale,1
RT JUBIRACY Em Dilma sobra cinismo falta vergonha A afilhada tanto apreço verdade quanto padrinho LulahttpstcoalvEGy,0
RT JuliaChamorro8 ExpressoEpoca A propria filha 16 anos expõe internet bebada drogada semi nua Se acionar PF capa,1
RT JulioSouza91 O PSG jogou branco dentro Camp Nou achou ia goleado kkkkkkkkkkk,0
RT julixsep BrothersDireita ClaudeLuca otmar03 FussballSehr E corpo Gisele Bundchen,0
RT julyarosas O mulher falando Eu tô esperando comida falando sobre sla Me senti burra MasterChefBR,0
RT JuMagalhaesBH A maior prova honestidade jairbolsonaro quantidade votos Câmara,0
RT JusticeiroSujo E caviar PC Siqueira querendo pagar semteto mole httpstcoY6GGoH3RW9,0
RT JusticeiroSujo Eu acho Movimento Negro realmente humildade seriedade próprio movimento MÍNIMO devem faz,0
RT JusticeiroSujo Isso aqui SpOAB vê Mas piadinhas editorahumanas faz gorda feminista preocupam httpstc,1
RT JusticeiroSujo Meu Deus Que catracada DaniloGentili GeekVox Quis lacrar fodeu httpstcop9CzFS1rlc,0
RT JusticeiroSujo O Facebook usou hijab homenagear mulheres DiaDaMulher O hijab maior símbolo opressão islâmica pa,1
RT JusticeiroSujo Um péssimo dia mídiaimprensa noticiaram nada simplesmente manipularam torceram retorceram cada fat,0
RT Kprishe NAOKAHLO realizei sonho dá esposa levei pra NYC claro podia faltar yellow umbrella httpstco,0
RT KAKA Querido Kfouri perdoo todos ataques pessoais fez Jesus ama também httpstcoWeZYtUK5TF,0
RT kathelencrf geração bosta q fica internet tuitando ai trump n representa n deixarei trump gorvernar paz bolsonar,1
RT knotcamacho HumorNegroo Mas incômodo,0
RT kordeidoI 6 emily fields fode emaya lindo sim maria sapatão merece bem toma tanto cu vezes acho qu,0
RT ladiedosite Fala mal capitalismo celularzinho papai deu,0
RT lafaeu estadohiramico dessa sabia httpstcoMaRzGzQmRT,0
RT LaudimaPalhares CurateAngola tivandro pra crianças,0
RT lauraamansur direitafalando choro rir,0
RT laurensexuals vc usa roupas complexas vc sapatão falam vc metido algo presta,1
RT LeMassaroto E nesse dia mulher confirmei acreditava TODA GENERALIZAÇÃO É BURRA,1
RT Leandrochargers direitafalando luisanunes Pelo fim corrupção outros continuidade voto SIM,0
RT leandrolechuga RachelSherazade A esquerda pira httpstcoLsHvX4RFQZ,0
RT Leandroow3 feliz dia esse meio acelerador,1
RT Leandroow3 feliz dia não roupa pra sair,0
RT Leandroow3 pode comemorar viu pai voltar cigarro,0
RT lelacohen rosangelabolze VemPraRuabr BecaBrix HumbertoReisJr HelosaLolo1 neusamandrade lenacasagrande jwbranda ESTAREMOS LÁ,0
RT LeluCosta E guri habibs morreu parada cardíaca devido uso drogas constatado lesão corporal AGORA A INTERN,0
RT Lemos3Nicolle Beijo gay hetero acho devia aparecer desenhos animados httpstcoFMeBI1CSuv,1
RT LeNaZZo homemdeverdade nao paga pau Ele paga mocreia tirar zica,1
RT LeNaZZo Um homemdeverdade eh akele q sabe procriar deixar vestigios,1
RT Leocadeea CurateAngola imenso Fantasias todo resto Porque introduzir diversidade Antes sermos adultos trancafiados,1
RT leumaSamiL 20 anos Odebrecht pagou propina FARC httpstcof5oGGK7eo9,0
RT LewisFace O Erro Do PSG Foi Jogar De Branco O Barça Pensou Que Fosse RealMadrid MSN,0
RT lfrancobastos About last night Overdose Tourette Checkem datas vejamnos país RuiHCruz OPauloAlmeida istoeserio D,0
RT lfrancobastos Próximo sábado 18 FEV levo solo Standup Voz Razão PORTALEGRE Bilhetes CAE Portalegre Fnac htt,0
RT lichteritter França Rinoceronte branco 4 anos zoo Thoiry baleado chifre cortado noite 2a p 3a dentro z,0
RT lionnisterz AS SAPATÃO TÃO NERVOSAZ httpstcoutM5uaa14Y,1
RT LissaniaMenezes Angola ainda ratificou acordo ortográfico Língua Portuguesa Escrevam bem yh,0
RT lobaoeletrico Eduardo Paes “Não sinto responsável dívidas Olimpíada” httpstcoiidNFLBPlp,0
RT lobaoeletrico MEUS AMIGOS A VENEZUELA ESTÁ VIVENDO EM RITMO DE GENOCÍDIO NÃO TEMOS NA MÍDIA NADA QUE DÊ A DIMENSÃO DESSA TRAGÉDIA,0
RT lobaoeletrico TODO ESQUERDISTA TEM UMA MENTE REDUCIONISTA E SEMPRE TEM DIFICULDADE EM ANALISAR FATOS REAIS,1
RT lokocorreia HumorNegroo jornal feito folha bananeira,1
RT lolaescreva Hoje dia revolução Todo dia deveria DiadaMulher 8MBR httpstcopr4Rp9nRu5,0
RT lolaescreva Meu post hj exclusivo importante Comunicação Senado proíbe uso termo feminismo httpstcoKVLkjrVtgE,0
RT LuanaPiovaniLP A corrupta Dilma recebeu 150 milhões propina disse q delação Odebrecht insulto honestidade Qua,1
RT lucasmcml Orgulho Hetero show w,0
RT luciaguimaraes TV russa tentou subornar jovens subúrbio Estocolmo provocar distúrbio mostrar refugiados adapt,0
RT luizapossi queria comer polvo copa gerou apego,0
RT LumiereCardoso Concluindo No fundo Disney quer audiência competição tá dura Na família assiste http,0
RT luomobli CarlosMvrtins CurateAngola desculpa gostava conseguir respeitar opinião consigo Se felizes,0
RT LvLvelasco43 Por favor fiquem firmes boicote Itaipava Divulguem httpstcoORPQsjCCBP,0
RT lycarr Toda vez vejo homem comentando toda feminista sapatão vontade gritar ouvido QUEM DERA,0
RT MElizanarciso filha puta donald trump diminui quantidade refugiados podem entrar país pq nao familia,1
RT maathbz 13 anos mãe finalmente menstruação veio larga besta furou cu prego cadeira wagner,0
RT maathbz Eu farei biografia Bolsonaro httpstcoXpTMT0Qw93,0
RT maathbz feliz dia ñ importa ñ falei to pensando querendo vc adivinhar senao vou ficar raiva passar 1 ano,0
RT maathbz Feministas Criticam decote feminista Ema Watson pq desvaloriza Acham Ema Watson q dar respeito feministas,0
RT maathbz Incitação estranhamente dia defendia prisão menor estuprador assassino enquanto PT defendia estuprador,0
RT maathbz Liguei pra mae tá caos lá pai deu facada irmao irma fugiu tudo pq Amor Sexo ta abalando famil,1
RT maathbz Não título melhor biografia Bolsonaro que JAIR BOLSONARO,0
RT maathbz foto perfil pisao familia tradicional morta esmagamento httpstcoJQ742cHRBX,1
RT maathbz fiufiu pra serio moral passarinho facil bemtevi latir pra pegar mal assobiar httpstcoAm,0
RT maathbz responde esquerdista merda httpstcoTJeFhQ4gAg,1
RT maathbz Saibam separar coisas Amanhã dia mulheres O dia veste mulher 1º Abril kkkkk,1
RT maathbz SE O editorahumanas matado mulher esquartejado dado pros cachorro tava solto piada feminismo É B,1
RT maathbz to pensando virar PM pra musica daniela mercury parar tocar passar mim so obrigado,0
RT mafiasumers Eu sei apoia Bolsonaro cara humilde esclarecido ver único cara honesto condenado dá ódio,0
RT Maggot00 HumorNegroo ai denunciei porra mercado fé daquii hahahah,0
RT maitabom Aonde coração ali estará tesouro,0
RT Marceljuca HumorNegroo deus nordeste esquento pq sei humor,0
RT Marciabasto Parabéns mesmo httpstcosr60ipyxIU,0
RT Marciariela Os novos gostam imitar vêem televisão pra mim boa ideia httpstcoXcRWNz2JgE,0
RT Marcitaum lobaoeletrico Diria q todo esquerdista orgulhoso fugiu aulas história pulou aulas filosofia nao sabe,1
RT marcknho lobaoeletrico Venezuela intervenção militar externa povo força armada força física lutar,0
RT margaridtavares Vcs fufas bue abusadas,1
RT marianaa016 saudades cantar islão todasmas principalmente cris nocas dia tixa rafa também,0
RT mariiapitanga azeiteiro quero q fodas volta terra,1
RT marisalobo Agenda Abril Seminário sobre Ideologia GêneroCom certificado 08 09 Abril AriquemesRO httpstco9FWPfwGNRv,0
RT marisalobo Menina veste menina NaoAIdeologiaDeGenero httpstcolrrht2dUq0,1
RT marisalobo O quer dizer exatamente httpstco1GcTutNH3Y,0
RT MartaaSrj Venero toda mulher causa nascimento Mas querida gira burra tempo,1
RT martabiancaa Trump Carvalho Encontrei net Não sei génio httpstcoKgmGgaCTBd,0
RT MaxwellBaliza JusticeiroSujo Essa página melhor modo provar justiça social passa modinha,0
RT MayaLamberti Olhem 3 carinho httpstco0gHWdvipAP,0
RT mayaramellon cheio opinião coragem falar criando personagem cara bolsonaro dó,0
RT MBLivre Bruno solto Presidente PCO quer matar conservadores processo tem Bolsonaro processado réu Estranho htt,0
RT MBLivre DanielCoelho45 proponentes reforma MBLFIPE previdência Aposentadoria digna justa todos p,0
RT meduardasiilva Pode gorda Pode feia Só pode gorda feia vemegea,1
RT melborba95 realmente eh grande rede fufas,1
RT mendilinda Vocês perceberam ta pra baixo basta colocar funk pra ficar lá encima mandando saradas ar,0
RT MeuPaiAusente Feministas podem esperar dia crianças trans podem esperar dia mentira comemorarem DiaDaMulher,0
RT MidiaNINJA Argentina Buenos Aires agora Só cresce tá lindo NiUnaMenos ParoInternacionaldeMujeres 8M VivasNosQueremos Foto em,0
RT MidiaNINJA Tá Lindo Av Rio Branco tomada mulheres Rio Janeiro 8M DiaInternacionalDaMulher DiaDaMulher httpstcoF,0
RT midiasemmascara Os católicos idiotas úteis George Soros httpstconmluaW7zjPhttpstcoT6QteLcWhC,0
RT Miguelparaiso23 Roses are Red Violets are Blue Pa quê Jonas Se Mitroglou,0
RT miguelvinicu aninhacaraujo sofiakalap BiaMontezumaMF vida babar ovo Bia bia feia gorda,1
RT miidulo Queria avisar amigas escola inteira conhece gente grupo sapatão viado sei disso Falaram,1
RT miikaaassis junta mt sapatao grupo n né,1
RT miltoneumesmo RuiHCruz OPauloAlmeida istoeserio dia 20 dia 23 RSC Lisboa Amanhã compro bilhete hoje vou dormir feliz,0
RT minahetero meuamigosecreto gosta ver lésbicas beijando gay aí pecado deus gosta,0
RT minasnahistoria Doloresmulher extrema importância p luta indígena latinoamericana Pobre índia comunista rebelde apaga,0
RT MiroG666 Os irmãos assistem bonecos muitas vezes querem boneco é Respeito favor ht,1
RT missnarcisista Tô amando perfil JusticeiroSujo Expondo justiceiros sociais politicamente corretos verdade,0
RT mizanzuk Sim fizeram isso httpstcocMNZywlBW8,0
RT MoceDumCabreste Com champô ganhas caspa ganhas oleosidade ganhas pontas espigadas ganhas nada httpstcoSd,0
RT monalizamos Mas hey toma aqui flor Sorria E engula dor Via Pietra Pinheiro InternationalWomensDay httpstcoq0xkKEDOWB,0
RT MonikaSouzaS Só acho muito esquisito mulheres todas artificiais falam gemendo nariz PreguicaDeGenteSemConteudo,0
RT MoniqueCheker Famílias perderam lavouras Ministério Integração Nacional respondeu dizendo faz vistoria barragens E,0
RT MoniqueCheker Obra barragem transp Rio São Francisco inaugurada sábado rompe parcialmente desaloja 60 famílias Incomp,0
RT MoniqueCheker Projeto sen acirgurgacz quer limitar atuação MP inquérito civil Tratase PLs nº 1982013 limita praz,0
RT MoniquePrada Eu paro respeito autonomia trabalhadoras sexuais E você para euparo httpstco1judJP66JT,0
RT monkwysmells 3 auto estima Esqueci útero Todos dizem bonita porem n acho bonita Apenas ga,0
RT Mozzein namoradinhas então tia httpstcohuId17fbpk,0
RT MRLeoBen Se assim filhos vão ver Disney httpstcoc5IB1MluPc,0
RT Mrmatheusgarcia Meu pai acabou chegar Angola 5° país africano vai trabalhar E pra qualquer um O pai foda Ma,0
RT MrsMolli Não concordo httpstcoBHcivmLAmk,0
RT MrTiagoMendes Grande espetáculo ontem OPauloAlmeida Se antes fã agora ainda mais Vale pena ir ver s,0
RT 2much4hoes É ridiculo acharem gays fufas diferentes todo resto pessoas normais gostos diferentes Deixemse disso,1
RT mundodrogado Antes homossexualismo proibidoDepois passou toleradoHoje normalEu vou embora antes vire obrigatór,1
RT mvsmotta Jandira Feghali passando timeline httpstcoJGESoKSEQ2,0
RT mvsmotta Qual motivo chilique Reinaldo Azevedo contra Joice Hasselmann,0
RT mvsmotta Se julgamento Nuremberg sido STFoficial Hitler saído nome limpo prescrição,0
RT mvsmotta Um eleitor Trump agredido delinquentes esquerda outro não Tente achar porquê httpstcoLqwhos9WXN,0
RT mynameiselianee Não vejo problema nenhum httpstcopN1mYflxLe,0
RT Myrull0 filha maria rosario x filhos jair bolsonaro confia pra dar conselho,1
RT NanaGouvea chegando boston,0
RT NAOKAHLO Avaliação livro MeuAmigoSecreto feminismo além redes amazonBR Obrigada httpstcopXpyDcQ3DB,0
RT NAOKAHLO Cinquenta Tons Mais Escuros empoderador abuso Post recente blog Leia em httpstcoOHHTWkT3Wy http,0
RT NAOKAHLO 11 dicas fazer – manter amizade outra mulher post hoje blog httpstcogT0erjqyjO http,0
RT NAOKAHLO Junta gráfico proposta reforma previdência tirem conclusões httpstcoLOMHLndjHX,0
RT NAOKAHLO Nesse Dia Mulheres pegue flores coloque túmulo mulheres assassinadas companheiros NãoQ,0
RT NAOKAHLO Pesado real Por estaremos ocupando ruas neste dia 8M httpstco1MfokO22kS,0
RT NAOKAHLO Repita comigo Não espere vá mudar mim Não espere vá mudar mim Não espere vá mudar mim N,0
RT naominfeliz ainda superei clipe baiana casal sapatão afrocentrado httpstcoEROEk1lBZ6,1
RT naosalvo Se vc trabalha empresa infláveis 2016 ano lucrativo estranho história dessa indústria httpstco,0
RT Naraameireles Como meninas consegue ir pra escola toda bonitinha Eu vou igual sapatão ainda so,0
RT natanael7souza Para comediante chama rafinhabastos dizia Bolsonaro sozinho BolsonaroMeRepresenta httpstco,0
RT nazaredfatima Não concordo nada contra homossexualidade httpstcoQFtgTER9DM,1
RT NevesIgor frases direita absurdo judeu reagiu cuspindo hitler imaginem contrário,0
RT NewDelia E países acolhendo refugiados Tem gastar dinheiro ajudando gente lá país Infelizmente gente dá,1
RT NewDelia Países ricos aceitam refugiados Estão certíssimos httpstcoTbLOkymjZx,1
RT newdoppelganger Estadao legal proselitismo barato sobre muçulmanas Vamos falar sobre mutilação vaginal também Falta dir,0
RT NexoJornal Para especialistas rotulação reforça preconceitos limita escolhas profissionais futuro httpstcocWsOxabHpB,0
RT ninguemanyone Com todo respeito dia sair criança lugar onde saem fezes humanos Levy Fidelix pod,1
RT nostrendsbrasil BolsonaroReiDoMundo Admiradores jairbolsonaro sobem tag homenagem apoio deputado NosTrendsBrasil http,0
RT nostrendsbrasil “Eu envergonho diz Rachel Sheherazade sobre Gleise Hoffmann” httpstcoO3U0r43Swp gleisi httpstcoKQwz,0
RT nostrendsbrasil “Filha petista posta foto coloca maconha boca cachorro” httpstcoIM7rD0DG4fhttpstcoaQzcr,0
RT nostrendsbrasil JoaquinResponde Personalidade Twitter JOAQUINVOLTOU interagindo fãs NosTrendsBrasil httpst,0
RT NoutraCoisa Namoradas hoje queiram sexo vez desculpa dor cabeça vestem camisola Ederson Não entra nada,1
RT nuchyg99 Mundo fufas mim,1
RT numiweb Também queremos ver sms Paulo Portas sobre negócio submarinos,0
RT nunesjoely QUANDO É PRA TER CONSCIÊNCIA HUMANA DURANTE O RESTO DO ANO VOCÊS NÃO TEM AI HJ VEM O CHORUME,0
RT NyaCrisana Acho MUITO BOM Que desde cedo crianças aprendam problema nenhum serse homosexual httpstcoJlY,0
RT oantagonista O leitor Antagonista responde Sim 783 x 217 Não httpstcoaEc9Dqoz6ahttpstcoODMoWREhOo,0
RT oantagonista Os políticos Moro conseguiu condenar httpstco1UiUjk2moShttpstco8pTLqYbpTS,0
RT oautentico3 Lamarca tentar correr atrás blocosovietico pique pra acompanhar morreu meio caminho httpst,1
RT obonholmer Fazer pesquisa intenção voto pro Bolsonaro Twitter igual fzr msm pro Trump Tumblr,1
RT OdeCarvalho 1 A confissão Odebrecht dava cem mil dólares mês FARC,0
RT OdeCarvalho 1 A mídia adestra povo julgue homem faz diz dele,1
RT OdeCarvalho Contribuição EdsonCamargo Maria Fernanda Rossi httpstcouzJqmiIZyM,0
RT OdeCarvalho Derrubar Estatuto Desarmamento A MAIOR VITÓRIA DO POVO BRASILEIRO longo toda história,0
RT OdeCarvalho 2 prova cabal ligação íntima PT guerrilha colombiana tantos negavam chamavam teoria cons,0
RT OdeCarvalho Já expliquei mil vezes Não nenhuma solução problemas nacionais algumas deixar b,0
RT OdeCarvalho Já notaram Nunca jamais terrorista ditador genocida chamado mídia extremista esquerda,1
RT OdeCarvalho 1 O senso estético primeira básica qualidades intelectuais humanas Bebês sabem distinguir bonito,0
RT OdeCarvalho 1 Poucos brasileiros conscientes país domínio hegemônico esquerdista TOTAL inegociável,0
RT OdeCarvalho 2 Se esquecerem faz isso podem estudar lógica resto vida passarão nunca imbecis,1
RT odedonafrida Dr Bruno sobre apuramento directo Sporting Champions httpstco9f3sbNJVy4,0
RT odedonafrida Nunca saem resultados eleições Sporting porque William Carvalho contar votos,0
RT odedonafrida O Benfica rouba tanto jogadores actuam cara tapada httpstcoo14fecGwuv,0
RT odedonafrida O Samaris fala melhor português Jorge Jesus,1
RT odedonafrida Senhor sente ver Benfica vencer Dortmund ter perdido duas vezes contra eles httpstco2MJ1Lf,0
RT OficialJoao Orgulho Hetero Homofobia Abs,1
RT OficialMrCatra O pênis melhor alimento feminino pois contém carne leite ovos enche barriga 9 meses HAHA,1
RT ofuxicogospel O Globo cria debate negativo sobre Psicologia Cristã Dra marisalobo fala sobre caso httpstcoZswd3njoDo,0
RT ofuxicogospel Oque vídeo PastorMalafaia httpstco34CuRyHTOd,0
RT OhFazFavor O presidente presidente httpstcoo3NexsMyIs,0
RT Oledobrasil Barcelona explica goleada Vimos PSG todo branco imaginamos Santos httpstcoAOgathhJ6Ohttpstco,0
RT olhosvioleta Ah mulheres O vocês A gente nada seria,0
RT olhosvioleta Feliz dia mulheres todas seguidoras lindas maravilhosas twitter parece jardim flo,0
RT olhosvioleta Hoje dia seres perfeitos planeta mulheres,0
RT olhosvioleta MaBolsonaria feliz dia mulher pra ti Lindeza,0
RT OlivaldoWeiler Então socialismo produz refugiados O socialismo falha httpstcoE7iM31S3CJ,0
RT omachoalpha sei neste momento Neymar creditando toda honra Ele httpstcoqQvfWuoLlQ,0
RT omalestafeito carrada dinheiro q voou daquie Cristas diz q Portugal deve Núncioo mínimo dar nome home,0
RT omarbrasilrj BlogDoPim A patrulha politicamente correto politicamente fascista A esquerda tolera diversidade Semeiam dit,1
RT OMundrongo ACABOU A MAMATA Doria congela orçamento Secretaria Cultura mamatas criadas Haddad httpstcop4gD1b2hsj,0
RT OMundrongo Silêncio envergonha diz juiz sobre ameaça estupro contra Sheherazade ignorada OAB mídia httpstc,0
RT opsluanjo Gente mulher parece tia fica cozinha verdade gênio física MasterChefBR,1
RT osprimitivos O q falta povo nordestino derrubar família Sarney maranhão corrupção sim piada sobre,0
RT otariano Começou meme httpstcowwadFAyoyy,0
RT otmar03 editorahumanas pecesiqueira Alguém sabe onde boné PC tá usando Linda mensagem httpstcoosDH7PFqc2,0
RT otmar03 Sem nexo gente queimou sutiã passado atualmente ter coragem queimar burca porque esquerda permite,0
