text,hatespeech_comb
"- Nossa, feminismo necessário hoje dia? : https://t.co/UVPYCewlCp",0
"Nossa, gosto cameras.. rs (@ryan_reminho live on http://twitcam.com/11hdu))",0
Nossa!!! Segundo 'Jênio' ateísta esquerdista cristãos grandes perseguidores religiosos!!!!! https://t.co/yDy5LBxYHM,0
Nosso livro tá 20% desconto @saraiva! Não percam! https://t.co/qHHp7SMH7t via @saraiva,0
"Nosso livro tá mega desconto @amazon! Sai R$ 17,94! https://t.co/4XWtzrIYYx via @amazon",0
Nosso maravilhoso novo plano saúde pública revisão negociação. O ObamaCare total completo desas _ https://t.co/ba3DBrlKqJ,0
"Nos ultimos 5 anos fugiram 52 reclusos prisões portuguesas. Curiosamente, nenhum banqueiro ex-governante...",0
10 notícias provam quanto feminismo necessário https://t.co/3mIKQvLOHL,1
Novela CGD – II https://t.co/M5TP8y8kM6#CGD #PNR #Bancos #Portugal,0
"Novo livro Nick Adams, Guerreiro Green Card, leitura obrigatória. A meritocracia caminho, Canadá Au _ https://t.co/W9O0pHwjKP",0
16 novos djs área galere #FinalBBB13,0
Novo trailer OVERDOSE DE TOURETTE - ON THE ROAD. Hoje explicamos Rui Cruz #OverdoseDeTourette https://t.co/T1qL8JkXv6,0
N racista pq racismo É CRIME crime coisa pretokkkkkk,1
*numa conversa normal sobre amiga minha* Mae: 'mas dás fufas bis porquê?' ://,1
"NUNCA PENSEI EM DIZER ISSO.MAS,VAMOS COPIAR OS EUA. AGORA PODEMOS!!!. #Trump Quer Ação Maior _ https://t.co/f1lzzFAUkU",0
"Nunca vi imprensa nacional tão descarada parcial. Virou torcida arquibancada. Patético! Aliás, democrática _ https://t.co/tOlvYTnnZR",1
nunca vou conseguir emagrecer vou sempre gorda feia fracassada,1
'Nutella pode provocar cancro'. Espero notícia ajude diminuir taxa obesidade. Basta gorditos continuarem mamar Nutella,1
N vou aguentar tanto sapatão sala fica encarando..,1
@nyahler Eu considero bonito George Cloney ...,0
"@nyahler Uma pessoa anorexia considera GORDO, MAGRO. voce pode considerar quiser...mas biologicamente so XX XY",1
@o__ferreira Volta terra,1
"@o_anjo14 @Valeriy_Yuri Oh fds ucraniano merda vem aqui, volta terra fdp",1
O amigo passa ano inteiro dizendo: 'aquela puta' 'gorda' 'não pego pq feia' 'feminazi' E AGORA VEM COM ESSA HIPOCRISIA,1
@OAngelo82 @odedonafrida Ia puxar emoji cão triste. Não preciso,0
"O argumento: 'abriram bueiro' Mas refuta linha falei! A verdade tortura, né? https://t.co/TmpjpEzzld",0
"argumento retardada mostrar sabe ler. Quero ver refutar falei fatos, lógica verdades! https://t.co/TzZ6WBlhPB",1
O arranque Tour 'Overdose Tourette -OTR' assim. A caravana segue dia 10 Vila Real dia 11 _ https://t.co/vkP9WZ5Sa8,0
"O arranque do'OVERDOSE DE TOURETTE-ON THE ROAD' prestes acontecer: -4 Fev,Figueira Foz. INFO: reservas@ca _ https://t.co/xzAoqIMPdt",0
"atentado orlando nao nada ver discursos preconceituosos trump bolsonaro, culpa estado islâmico!!!!",1
@oautor Espero ganhem. Tenho muitos amigos Sporting fica difícil falar distância 13 pontos,0
O balanço divulgado Polícia Militar revelou menos mulher agredida cada quatro minutos no... https://t.co/SuVbgUQPId,0
O Barça viu PSG branco pensou Real... aí deu deu né kkkkkk,0
O Barcelona empatou campo Bétis deste golo ter sido validado. É óbvio #ACulpaÉDoBenfica https://t.co/0QxbHjBEFn,0
O Barcelona venceu PSG graças feminismo,0
O Batáguas vai ter fazer Joana https://t.co/MAmYuhv6Rt,0
Obg grandes Xerifes Chefes Polícia serviço & liderança. Vocês verdadeiro amigo _ https://t.co/1aOMPZ4whQ,0
"O #BlocoEsquerda, ponta-de-lança cultura morte, quer agora legalizar Eutanásia. Por mim defendo Vida dignidade. @EsquerdaNet",0
"#BlocoEsquerda, promotor Eutanásia, tema programa eleitoral. Isto honesto? @EsquerdaNet https://t.co/CyYCcDKPj4",1
O BLOCO PORÃO DO DOPS É BEM MAIS ANIMADO... VENHA CAIR NESSA FOLIA @vanessasenadora #PAZ https://t.co/bIwPH4RQFy,1
bolsonaro nao parabenizou cunha vdd gente culpa edição video,0
#OBomDeSerBrasileiroÉ menos nao vem refugiados Oriente médio pra k caras nao sao burro,1
brasileiro cansado enganado!!! sos regime militar get out dilma,0
brasil crise drogados querem saber droga https://t.co/9DVO4wngQA,0
O BRASIL NÃO QUER LEGALIZAÇÃO DE DROGAS #STF Legalização drogas rejeitada maioria população... https://t.co/zM4PNOcdaI,0
Obrigada amigos.Já passamos 600 inscritos 24 horas. Inscreva-se novo canal entrevistas. Vamos... https://t.co/FrF0HqrMx7,0
Obrigado @exxonmobil $20 bilhões investimento criando 45.000 empregos indústria c _ https://t.co/6VuiYFglur,0
Obrigado primeiro ministro Austrália falar verdade sobre educada conversa mídia NOTÍCIAS FALSAS distorceu. Ótimo!,0
"Obrigado Brian Krzanich, CEO @intel. Um grande investimento ($7 BILHÕES) INOVAÇÃO EMPREGOS Americanos! _ https://t.co/XWXvkPX2IG",0
Obrigado Eli Lake Bloombarg View - 'NSA FBI...não deveriam interferir política...e é' Uma situação mu _ https://t.co/R2YMaXu1N2,0
Obrigado grandes comícios todo país. Tremendo apoio. Vamos Tornar América Grande Novamente! https://t.co/ncyrBNc5aQ,0
Obrigado todos elogios Conferência Imprensa ontem. Rush Limbaugh disse melhores. E m _ https://t.co/ciHsjyqcVf,0
"Obrigado Porto! Hoje seguimos Aveiro. Teatro Gretua, 22h00. #OverdoseDeTourette #OnTheRoad #RacharLenhaPreta https://t.co/mTul25WiaV",0
"Obrigado, @samsung! Adoraríamos tê-los aqui! https://t.co/pqg6E3mIeO (SAMSUNG PODERÁ TER FÁBRICA NOS EUA)",0
OBRIGADO SÃO MUITAS PERGUNTAS NÃO DA PRA RESPONDER TUDO 11:30 VOU FUMA UM CIGARRO BEBE UMA CAIPIRA COMPRA UM FRANGO ASSADO #JoaquinResponde,0
OBSERVAÇÃO: ESTAMOS NA QUARESMA (FAVOR SUBSTITUIR O XIS BÊICON POR PEIXE FRITO) O RESTO TÁ TUDO LIBERADO. OBRIGADO.,0
OBSERVAÇÃO IMPORTANTE SOBRE O #DIAINTERNACIONALDAMULHER https://t.co/0vGVU7iho2,0
#observador Catarina Kinnvall: “É similar forma islão radical extrema-direita _ https://t.co/TmjEC69oSt,1
"O 'bullying' hipócritas comunicação social diversos sectores sociedade. Força, @realDonaldTrump https://t.co/bIxHoC18SL",0
"O Canadá quer receber 40 mil refugiados,resumindo 40 mil desempregados.Isso explicam população.",1
O canalha ditador @NicolasMaduro conseguiu destruir Venezuela. Venezuelanos fogem Brasil outros países d _ https://t.co/OnUMT25wZe,1
"O capitalismo realmente perdoa nada. É única salvação além ideologia sanguinária comunismo. Hipocrisia, _ https://t.co/WZx4PkBH61",0
O CARA É FO-DA!! Nem tomou posse criou empregos Obama sequer sonhou! https://t.co/KIC75CXNJr,0
"O cara muda turma manhã, tarde vira relator Lava Jato. Tem treta não, imagina... https://t.co/3XnjgagaJ9",0
O cara promove celebra ASSASSINATO DE BEBÊS INDEFESOS NO VENTRE DA MÃE. Não existe grau maior podridão. SE _ https://t.co/OSy9Bwcj6L,0
"O cara tá carro ROUBADO, parado, sai ATIRANDO contra PM consigo armas GRANADA! Mas SUSPEITO (! _ https://t.co/H2cJWz2oQn",0
"O CDS plantar moralismo vida política portuguesa. Depois demissões irrevogáveis, demissões prazo. Aprende Centeno.",0
O CDS avisou Centeno 'consequências penais' mentir Parlamento. Mas algum ex-deputado CDS preso?!...,1
O cerco fechando pro Obama #ObamaInJail https://t.co/eO4MtYylzy,0
O cerco fechando. https://t.co/3ASl9RGinT,0
"O ciclo retardo: pessoa posta merda, zuada, aguenta protege conta https://t.co/sc4Uxs4gZZ",1
O #ColégioDomPedroII chegou fim poço.Vejam cartaz colocado unidade centro RJ. _ https://t.co/MJIuXGcT92,0
1. O @cqc criticava governo 2. @Srta_Iozzi @erikgo entram CQC 3. CQC acaba 4. Ambos hj defendem PT Crític _ https://t.co/OV3HWV9x39,0
@OdeCarvalho prefiro magra feia gorda bonita. Mesmo gordas arrumarem ñ adianta falta d elegancia porte físico,1
"Odeia Bolsonaro? Então diz ai projeto discorda porquê. Vamos ver inteligencia, nível i _ https://t.co/RlqDhg5Q3S",0
-Odeio feministas falam merda -Vamos fazer q? -Perfis falsos zoando coisas q nunca disseramkkk -KKKKMitou,1
odeio gente fala so pq iggy eh branca n pode cantar rap mano QUE,1
Odeio mulher burra,1
Odeio sapatão Não desapega ex nunka,1
"O desejo homem mulher, desejo mulher desejo homem. Ou mais... #MulherDeVerdade",0
"O dia 17 Dezembro dedicado, íntegra, autêntica maratona reuniões sede PNR, Lisboa. https://t.co/cJeVuUH8PK",0
dia bruxas noite solteiros,0
"O dia todos muçulmanos morrer,certeza inferno vai sobrecarregar.",1
diminutivo INHO acompanha trajetória HOMEM DE VERDADE.,0
O discurso ódio vale contra Direita/Evangélico pra lacrar https://t.co/YFoSmKhZpJ,1
"discurso socialismo pode bonito, capitalismo comida, iphone, viagem pro exterior etc",0
"O Dono desse twitter autista, pode kkkkkkkkkkkkkkkkkkkkkkkkkkkkkkkkkkkkkkkkkkk https://t.co/QGoqrnYMR4",1
O ECA fechou olhos próprio estatuto afirma sexualidade poder ensinada crianças após _ https://t.co/sc7Tfqt6Kb,0
"eduardo bolsonaro nao cuspiu jean, tudo truque vídeo manipulados",0
O Eduardo Lourenço daqueles pensadores parece ter descoberto tarde unicórnio conciliar Deus com... https://t.co/plc4Y6mQB0,1
O engraçado - err correção: estúpido - gastar todo tempo falando mal feminismo pautas considera 'imaginárias'.,1
"O ESQUERDOPATA imbecil GOSTA COMUNISMO QUER morar CUBA, CORÉIA DO NORTE ANGOLA países COMU _ https://t.co/mtXyW9owC7",1
O estado Justiça Portugal https://t.co/oR31YZyYhQ#PNR #RenovarPortugal,0
O estranho caso TSU https://t.co/tmh1XPS9Fv#Portugal #RenovarPortugal #PNR,0
"O Facebook caiu justo agora ia compartilhar imagem pra doar 0,056442 centavos pra coral crianças mudas cabelo",1
O FACEBOOK CAIU VAMO VOLTAR PRO ORKUT GALERAAA,0
O Facebook usou hijab homenagear mulheres #DiaDaMulher O hijab maior símbolo opressão islâmica _ https://t.co/SkHBYLsMLh,0
O falido @nytimes cria grande NOTÍCIA FALSA sobre China dizendo 'Sr. Xi falou Sr. Trump desde Nov. 14.' _ https://t.co/iBHOBjRlSr,0
O falido @nytimes forçado desculpar assinantes pobre cobertura feita vitória elei _ https://t.co/VFZ4y8j3ap,0
O famoso 'não argumentos' https://t.co/vuTYTuerRO,0
O fascismo esquerda dois prints @leandraleal https://t.co/G6n9BPPcwb,0
O FBI totalmente incapaz parar 'infiltrados' segurança nacional permearam governo _ https://t.co/DK69kTQXud,0
O feminismo “faça acontecer”* outras variantes feminismo empresarial falharam esmagadora maioria... https://t.co/nifAweAInR,0
'o feminismo importante demais ficar mãos feministas' - saiu @folha pleno 8 março,0
'O feminismo capacho esquerda' ' VocÊ nazista' hahahahahaha retardado!!!!! Refute fale _ https://t.co/oHA1P45vpx,0
feminismo Brasil mero cooptador mulheres militância esquerdista! Não defende mulheres apenas _ https://t.co/qSvyplfFcp,1
oficialmente mulher burra mundo,1
"O foco resistência aqui! Ainda gostamos mulher, pinga, rock n roll futebol ! Ainda gostamos churrasco, carne sangrenta...",0
O FUTEBOL AINDA RESPIRA https://t.co/0z9iiuqky8,0
@ofuxico_oficial ESSA mulher pq transa cara vadia burra garota escrota nao nada .,1
"O gay assumido bem resolvido bem @homemdeverdade frangas arrogantes, dissimulados enfrentam própria cara espelho!",0
O @gduvivier adora passar vergonha https://t.co/VL6Fv63JbD,0
O @gduvivier quer fim PM usando mesma segurança. Nessas horas 'fascista' vira heroína!,0
"O General Keith Kellog, conheço bom tempo, grandes chances ir pra NSA - outros 3 _ https://t.co/tqs1YDByft",0
"O Henrique Raposo dito nada contra comunas fachos, pois amigo duas coisas...",1
@OhFazFavor deixa lá apenas Algarve...,0
@OhFazFavor assim tanto vento?!,0
"O hino cerimónia tomada posse Presidente reality show,foi cantado miúda q reality show. Tudo dito",0
@ohmycavill menos mal! ainda esperança pra você!,0
"Oi, amores... @dra_e @agdabritto @Tais_Renata @Coisasdelouco @joaohamu @RitaCassiaCosta @renatuuus Vcs noção correriaaaa Aff Xeru",0
O @ibelongjb merece parabéns dar @Desesquerdizada @Justiceiro_Sujo @tommoskyfalls Da série vivo™_ https://t.co/py30uxfU7p,0
"Oieeee, amoresss! Tô mtooo emocionadaaaa! MINHA SOBRINHA LINDAAA NASCEUUU! Parabéns Kilma Lipe. Mano, amo! Bem vinda, Karol! #renovacao",0
'oi lembra mim?' 'eu nao lembro comi ontem rsrs' 'voce comeu ontem',0
@oiluiz vou aqui torrent! Pearl Harbor tbm ótimo quase 3 horas,0
"@oiluiz vi não, vou vencer preconceito ver hahahahaha",0
"@oiluiz sim, filme bom longo",0
O imbecil realmente sabe diferença casal ama PORNOGRAFIA INCENTIVADA NA TV. Há 100 anos at _ https://t.co/PcsfCy8UWj,1
"imbecil usa ironia figura linguagem responder, consegue refutar nada falei!!!! https://t.co/ah86XoYVJg",1
"'Oi, sapatão' KKKKKKKKKKKKKKKKKK",0
intelectual tipo k chega mesmas conclusões povo uns anos atraso https://t.co/DMnpz8isTi,1
"Oi pessoal, aqui Marisa Lobo , preciso ajuda assinar canal YouTube! Preciso pelo... https://t.co/TXKbkjdbei",0
"Oi pessoal, aqui Marisa Lobo, preciso ajuda, inscreva canal YouTube! _ https://t.co/RnxdA0YDh9",0
O Irã ADVERTIDO formalmente disparar míssel guerra. Deveriam agradecer ridículo acordo EUA fez eles!,1
O Iran brincando fogo - agradecem quão 'legal' presidente Obama eles. Porque serei!,0
"O Iran dominando cada vez Iraque após EUA ter desperdiçado três trilhões dólares lá. Obviamente, tempo atrás!",0
"O Iran últimos suspiros, pronto prum colapso EUA veio salva-vidas forma acordo c/ Iran: $150 bilhões",0
"Oi, vc sapatão, n sabe ainda..",1
O @jairbolsonaro assumiu causa choro todo pelegada pleno começo 2017. Imagine ano _ https://t.co/3qjpcW4GtH,0
O @jeanwyllys_real tão lixo acusando @jairbolsonaro mandante exposição filha Maria Rosário,1
O Jorge Jesus acusou regresso Kelvin Porto,0
"O Jorge Monforte bué burra ya, vai dizer quer ter filhos mimada Bia mulher pediu abortar? Ahahahaha burro",0
"O jornalismo poder censório, manipulador, tendencioso tantas vezes mentiroso. Afinal mundo vive _ https://t.co/nTh0VR1qlE",1
"O @JornalOGlobo ainda fé vai funcionar! Acho colocar tb umas pombinhas brancas, aí bandidos des _ https://t.co/ee8X1lbS0H",0
O @JornalOGlobo consegue dizer mesma matéria cara entrou armado roubar ainda assim chamá-lo 'SUS _ https://t.co/nHsOZvDXvg,0
O José Manuel Coelho vez pedir asilo político 'principado' Pontinha devia pedir vila Cascais. Com Salgado resultou...,0
O juiz abre país possíveis terroristas outros objetivo melhores interesses. Os _ https://t.co/tL74UdFmnb,0
@ok__diego acordei sapatão hj,1
"@okiamxico @Refugees @Refugiados_Pt Sim, país, data, cheio muçulmanos. Hoje bem pior!",1
"Olá, Gatas (e gato hahaha) @jujuba_lima @aninha_ebc @tais_renata @Quase_Gay @agdabritto @CHRISMORANGUETE @zoooiul @dra_E @marlenebicalho",0
Olga Benario vagabunda comunista safado Getúlio Vargas entregou pro amigo Adolf...,1
OLGA BENARIO Vai toma cu https://t.co/ux61TtGZLh,1
"Olha canalhice chamada! Como 'culpa' lei, criminosos! https://t.co/9XX51a28Tg",0
Olha cara @jairbolsonaro qm tá ligando cus sujos fazendo https://t.co/QTGF3jtLfv,1
Olha ae oportunidade q vc queria: ganhar respeito 'tico'. Imperdível! https://t.co/AkKrQsEo72,0
Olha explosãooo qdo Portugal chegar Islão https://t.co/nrVDE1TI8a,1
"Olha aí, DEP Ex.BBB pressionando procuradoria prejudicar prefeito Ariquemes, _ https://t.co/3Th6Y7SS1D",0
olha aí! O sempre digo: - repete chavão militância manda. - xinga oponete - refuta nada _ https://t.co/o9JLhALq1x,0
Olha lógica... kkkkkkkkkkk.. nao quer obrigada feminista? virou feminista obrigada...kkkk https://t.co/X3U8TYfbYc,1
olha vagabunda mostrando cara https://t.co/DpPnUWe2Nt,1
"Olha bem mulher, vou sincero, quero ver branco, quero ver altar",0
Olha aqui @policiafederal apagou printei https://t.co/tUIuFGLlty,0
Olhando bunda Ellen Roche https://t.co/LGZYkikSeP,1
olha Bruno jogar mostrando melhor goleiro pegar penalidades máximas,0
Olha NÍVEL noticiário maiores jornais país!!! É sério gente PAGA pra ler isso??? https://t.co/7tqxQ81EY6,1
Olha processinho pistoleira https://t.co/xBgiow0dcj,1
olha q sempre falo: Intolerância religiosa: termo usado Esquerda p/diluir religião cristã atrocidade _ https://t.co/LDoX8wDZbf,0
Olha primeiro pros peitos mulheres.,1
Olhem MEDO mídia @jairbolsonaro presidente https://t.co/cN6qv9C3fc,0
"O Lula falou melhor Marisa fez ficar submissa dar palpite. A platéia, repleta femini _ https://t.co/25zXrS30ef",0
O Lula bloqueou twitter Alguém deve ter lido pra piadas...,0
lula nunca acertou nota azul guitar hero,1
O mail reservas reservas.parc@gmail.com,0
"O maior prazer mulher inteligente, fazer-se burra perante burro faz inteligente",1
"O Mal PSG jogar Branco, Barcelona confundiu Real Madrid",0
@OMarceloWilson Marlon Brando né... Mas segundo tbm foda!,0
Omã segue ramo Islão diferente resto Médio Oriente.,0
"O melhor Angola, Angolano dúvidas!!",0
O dia ganhou vosso. Por capote https://t.co/Sscy8CZ9ot,0
O trabalho sobre Refugiados resume-se Lady Gaga! Faz sentido? Não!,0
"verniz branco feio, parece corretor",0
ministério cultura nao servia pra nada bando vagabundo fazendo merda palco ganhando pra,1
O movimento levar hashtag #RacharLenhaPreta trend Twitter começou hoje Porto https://t.co/rPEUu5b01L,0
O movimento 'Vai ter gorda praia sim' parece funcionou. https://t.co/kmwq2k20e6,1
O mundo sapatao ligado imaginava,0
"O Murilo deixou prova branco, vou bater nele",0
Onde classificam menos. Desta vez tendo concordar @fcancio (mas habitue). Trata-se devassa grat _ https://t.co/aTl25RkD2a,0
onde FEMINISTAS ??? https://t.co/xEVjoZie3h,0
O nível destas três 'senhoras' exigem respeito #Trump... @MileyCyrus @Madonna @ladygaga https://t.co/DHVU09C9rU,0
"@ONomedoVentto @PSOLOficial Claro, maior crise econômica últimos 20 ano resolve 6 meses... vc perfil comédia, né?",0
O regresso prometido @18Jotta https://t.co/CFw1Uvu0LF,0
Ontem batemos recorde utilização palavra 'nabo' TV Portuguesa. Não acreditam? https://t.co/MGGG26aPJi#OverdoseDeTourette,0
"Ontem, representantes #FLECFAC: dirigente #CarlosPuna (ao meio). O #PNR apoia causa cabindas, traído _ https://t.co/6AFTtXT0kB",0
"Ontem lembrei q mttttt tmp atras ,acho q uns 7 anos professora sapatao ,descobrir q hj possui nome allan",1
ontem perfeito entendi monte estado legalizando maconha querem país dominado zumbis larica cérebro?,1
"Ontem ver Benfica. Foi grande noite, momento tentei entrar casa mulher decidiu imitar Ederson...",1
"Ontem, Gabriela Moura, integrantes, agência P3K Comunicação ministrar palestra... https://t.co/JYUHFOOc3I",0
"Ontem, intervalo almoço excelente reunião Conselho Nacional. Ambiente alegria ânimo. _ https://t.co/7Au5aNJJ7o",0
O NYT agora médico. E tá roendo insignificância cada vez maior https://t.co/CRkeOXV7jN,1
"O @nytimes falido escreve total ficção sobre mim. Cobriram tudo errado 2 anos, agora inventando fontes _ https://t.co/tUx5x5KdG2",0
"O Obamacare continua falhando. A Humana sairá 2018. Iremos revogar, substituir recuperar planos saúde _ https://t.co/YQzU6btFDs",0
O Ocidente suicida-se. Os governantes primeiros culpados. Portugal excepção. https://t.co/ARSJeiorPe,0
O 2o fim Nirvana https://t.co/866rfyO0Hc,0
O orçaminto “NIM” https://t.co/kB9nAb8BBJ#OE2017 #RenovarPortugal,0
O orgulho hetero tão válido quanto orgulho homo. Se pode ter orgulho outro não? #orgulhohetero,0
"Opa, 'certíssimo'! Vida humana vale nada aqui mesmo, é? Que belo exemplo! Mas ai quebrar ov _ https://t.co/vXYFL0zecD",1
@OPauloAlmeida Bilhetes disponíveis aqui: https://t.co/NeiqhncuJp,0
"@OPauloAlmeida E juntar isso, assustava fogo artificio",0
O Pensamento masculino. Sem rodeios! Bem vindo homem. Você mulher. #revelações Aguarde!,0
pior cego pode escutar,0
"O pior cego quer enxergar, ranço mulher burra !",1
pior tudo MULHER defendendo filho puta assume abusivo E ELA DEFENDE O CARA MIGA PARA VC TA SENDO BURRA,1
O plano recapitalização CGD vai custar seis mil milhões euros https://t.co/doG8riVuMG,0
PMDB sempre lado democracia,0
"O #PNR, contrário desinteresse demais partidos órgãos soberania, apoia justa luta cabindas. https://t.co/zwF4xKVKEe",0
O #PNR apresenta-se primeira vez #SantaMariaFeira autárquicas. Força #AnselmoOliveira @Lusa_noticias _ https://t.co/6Ot13kpoXX,0
O PNR congratula-se redução TSU ! Não colocamos interesses partido frente interesses nacionais. https://t.co/TLwpdj7yDy,0
O PNR Dia Portugal https://t.co/w6Kf1KGo4M#RenovarPortugal #PNR #Portugal https://t.co/VxGV1feTrq,0
"O #PNR cala ante marxismo-cultural, censura 'tolerantes' hipocrisia 'faz-de-conta' (que nada _ https://t.co/XLvvuy2PiG",0
"O #PNR solidariza-se dor família enlutada, morte Agente serviço Nação. #GNR _ https://t.co/L4woxi9etD",0
"O politicamente correto algo completamente doentio, cogita homem menstruar. https://t.co/OiUg6vHh4c",1
O politicamente correto tá fudendo tudo,1
O porteiro @homemdeverdade! RT @_latinlover_ Massagear EGO mulher elogiar bunda peitos. Isso porteiro faz,0
O primeiro encontro Jeff Sessions emb. russo organizado governo Obama programa educacional pa _ https://t.co/ao0IYrt7re,0
"O problema Islão etnia sim ideologia, visa destruir Cristianismo! E referi f _ https://t.co/mRmiFkBoLT",0
"O problema nunca piada sim esquerdista. Se for, pode zombar PM tá tudo lindo. Na hora _ https://t.co/ICdlGCEHob",1
"O PSOL seguir ideologia comunista coreana onde come cachorro, levaram pé letra... https://t.co/AQAzISQzmz",1
"O q mulher d bonita, d puta, burra mentirosa. N sabe q ta passando mão amigos",1
adianta vc dizer sente pena consegue refutar linha falo???? Isso tática _ https://t.co/sZT99syPKl,0
"O @BuzzFeedBrasil junto @g1 @GloboNews fazem chama jornalismo. Se chama mico, militância derrubada picareta.",0
clodovil queria aprovar PL reduziria 513 250 politicos congresso. NÃO DEIXARAM.. _ https://t.co/mOaWEWoBQC,0
O intervenção CÍVICO MILITAR?Este vídeo fez pensar. https://t.co/8L06qY07KQ,1
O Globalismo? - Lauren Southern Muita gente ainda compreende.... https://t.co/mg2bBTXGQZ,0
O juventude fazendo tal liberdade? Confundindo libertinagem. Quanto faz... https://t.co/Dw4OZ8xPQS,0
O mulher falando ??? Eu tô esperando comida falando sobre sla. Me senti burra #MasterChefBR,0
"O incomoda trabalhar G1 escrever 'hajir' verbo, conta verificada https://t.co/ZduXA74DaR",0
O Barcelona acaba fazer vai ficar sempre história futebol. Que remontada incrível!,0
O feminismo fez muçulmana?,0
posso usar lavar tênis branco?,0
O quer dizer exatamente? https://t.co/1GcTutNH3Y,0
"O 'válido', então? Feminicídio? Estupro? Mercado trabalho? Falamos disso todo dia. Poderia dedicar coluna isso, então.",1
O faz islâmicas podem falar? https://t.co/B1Y4XicjLc,0
"O racismo esquerda passando tl. Esse pode, politicamente correto, aí protestos. Imagina _ https://t.co/Yh5eBHEiN2",0
"O racismo mulheres negras latinas sofrem áreas ciência, tecnologia, engenharia matemática > https://t.co/TPqO635N7z",0
"O racismo vai acabar, deixar existir homem branco homem negro passar existir apenas HOMEM",0
@oradorgas @RedeGlobo @alexandregarcia estagiário fode nessas,1
"Ora ora, passado bem sujo aqui https://t.co/a6rIuQD3mx",0
O Raúl José vai cagar deve pedir autorização Jorge Jesus #LibertemORaulJosé,0
O @realDonaldTrump começou discurso mandando alô pra @carolcimenti . Que moral hein?? Ahahahahahahahaha!!!!!!!!!!!!!!!,1
O repórter @pvedova lembra 'crimes ódio' cometidos contra imigrantes esquece números crimes cometidos PELOS imigrantes.,0
O resultado jornalista saber fala passar vergonha pública dessa: https://t.co/892pXASsHG,0
"O retrato disso? A juventude atual, mostro aqui todos dias, mesma presente protestos esquerdistas _ https://t.co/FqQxt1eviX",0
"“Orfeu XXI, Música vida dignidade”. 'Não há, afinal, fronteira muro possa conter música mundo. https://t.co/N0nM87WuDH",0
orgulho BRANCO,0
"O ruim ter chileno branco uns dias, fica preto",1
"Os bebés adoptados c/ telemóveis novos: Qd vamos buscar desesperamos deixamos cair. Qd vemos 1 defeito,abrimos conta OLX",1
Os benfiquistas aguardam ansiosamente reeleição Bruno Carvalho. O único receio russos decidam interferir eleições...,0
"Os bilhetes Figueira, Faro, Lisboa, Porto Évora venda sítios costume #OverdoseDeTourette https://t.co/ELEbFhVQI0",0
Os cara fica expondo trabalho. Me chamando sapatao. Mereço.,1
"Oscares, Prémios Nobel afins: politiquice, interesses influências. Vergonha! Seriedade mérito? Pois... #AcademyAwards #NobelPrize",0
"Os democratas criar justificativa derrota eleições, então inventaram história - RÚSSIA. _ https://t.co/h8M5A5zwgk",0
"Os europeus vão acordando reagindo. Pela Europa Nações, Nacionalismo, contra mundialismo opressor! https://t.co/ouKuV9RIpB",0
'os funcionários mataram menino Habib's pq negro pobre' Hahahahhaha funcionários Habib's ricos,0
Os guris nutrição faculdade todos iguais Branco musculosinho tatuagem maori braço,0
OS HEITENS (ODIADORES EM INGLÊS) JÁ ACUSARAM O GOLPE. TRISTE DEMAIS ESSA CULTURA DE ÓDIO A MEU RESPEITO. #PAZ _ https://t.co/j7y5THFNMK,0
"Os 'homens' governo Suécia. Sem bolas, afeminados... Não acaso 'refugiados' deitam rolam naque _ https://t.co/fDoIRrLlOM",1
"Os homens todos iguais, deixam tudo última hora. O Dia Namorados amanhã hoje começaram assaltar relojoarias",1
O @showdavida dose diária anti-trumpismo. Quando vão fazer reportagem sobre 16 países proíbem entrada israelenses??,0
Os idiotas cancelaram conferência d Jaime Nogueira Pinto pequena sala FCSH arriscam-se vê-lo esgotar pavilhão Meo Aníbal,0
islamicos moderados filmando tirando foto...os Islamicos praticantes alertando ocidente _ https://t.co/nEaj8goSyw,1
Os jovens @pnr #RenovarPortugal #Portugal #PNR https://t.co/co7Ywrldht,0
Os 'média' pilar sistema combatemos. Deles podemos esperar mentira e/ou omissão. #Fakenews _ https://t.co/Q6BaDIUZlG,0
Os memes Nana Gouvêa tão divertindo kkkkkkkk http://t.co/6WuQbtv2,0
Os muçulmanos bem-vindos ! https://t.co/8RUKACkCQ3,1
Os muleke liso sim governo mais.,0
",,,,, negros estudem estudei ,,,,,,,,,",1
O sonho 'liberdade expressão' 'exercício democracia' deve China Cuba. Um conservador presidência?? Jamais!,0
O sonho telemóvel ter rede tão forte pescadores Nazaré arrastou bomba 200 Kg rasgar!...,0
"Os países solidários pobres, abertos refugiados. A Europa fecha. O Velho Mundo mesmo...",0
